{
  "content": "[Persona_1] (4 segundos | seriedad | Revisa su reloj)\nNo nos vamos a ir hasta que Persona_3 termine sus pendientes {{fx motion.ken-burns.exposition.documentary.v1.0.0 role=dominant intensity=0.52 target=frame endX=0.16 endY=0 scaleEnd=1.14}} {{fx stylize.light-leak.atmosphere.film.v1.0.0 role=finish intensity=0.34 target=frame color=#ffd07a intensity=0.28}}\n[Persona_3] (3 segundos | seriedad | Levanta la mano)\nPero ya acabé mis pendientes {{fx motion.push-in.emphasis.subtle.v1.0.0 role=dominant intensity=0.4 target=speaker}}\n[Persona_1] (3 segundos | felicidad | Se inclina hacia adelante)\nEntonces vámonos {{fx motion.rack-focus.attention.depth-shift.v1.0.0 role=support intensity=0.32 target=speaker blurPx=10 focusTo=subject}}\n[Persona_3] (4 segundos | confusión | Mira la pantalla de su computadora)\nEsperen, ya solo me falta escribirle un correo a los de Sistemas {{fx motion.camera-shake.impact.decay.v1.0.0 role=dominant intensity=0.58 target=frame amplitudePx=10 decayMs=520 frequencyHz=9}} {{fx stylize.color-grade.coherence.clean.v1.0.0 role=finish intensity=0.32 target=frame contrast=0.18 saturation=1.18 tint=0.08}}\n[Persona_1] (2 segundos | seriedad | Horror)\nNoooo… {{fx motion.camera-shake.impact.decay.v1.0.0 role=dominant intensity=0.58 target=frame amplitudePx=10 decayMs=520 frequencyHz=9}} {{fx stylize.color-grade.coherence.clean.v1.0.0 role=finish intensity=0.32 target=frame contrast=0.18 saturation=1.18 tint=0.08}}\n[Persona_1] (2 segundos | seriedad | Horror)\nOSD (Dum!) {{fx stylize.light-leak.atmosphere.film.v1.0.0 role=finish intensity=0.3 target=frame color=#ffb15a intensity=0.24}}\n[Persona_3] (2 segundos | seriedad | Teclado en mano)\nEs rápido, es solo un correo {{fx motion.push-in.emphasis.subtle.v1.0.0 role=dominant intensity=0.4 target=speaker}}\n[Persona_3] (2 segundos | seriedad | Teclado en mano)\nOSD (Prrrrt) {{fx motion.rack-focus.attention.depth-shift.v1.0.0 role=support intensity=0.32 target=speaker blurPx=10 focusTo=subject}}\n[Persona_1] (3 segundos | seriedad | Entrecierra los ojos)\n¿Seguro? {{fx stylize.color-grade.coherence.clean.v1.0.0 role=finish intensity=0.28 target=frame contrast=0.08 saturation=0.9 tint=0}}\n[Persona_3] (3 segundos | seriedad | Empieza a escribir)\nSí, sí… {{fx time.punch-edit.impact.snap.v1.0.0 role=dominant intensity=0.42 target=frame}}\n**SALA**\n\n[Persona_3] (3 segundos | seriedad | Se estira)\nListo, ya terminé {{fx stylize.light-leak.atmosphere.film.v1.0.0 role=finish intensity=0.3 target=frame color=#ffb15a intensity=0.24}}\n[Persona_4] (2 segundos | seriedad | Suspira)\n¡Por fin! {{fx motion.push-in.emphasis.subtle.v1.0.0 role=dominant intensity=0.4 target=speaker}}\n[Persona_4] (2 segundos | seriedad | Suspira)\nOSD (Yay) {{fx motion.rack-focus.attention.depth-shift.v1.0.0 role=support intensity=0.32 target=speaker blurPx=10 focusTo=subject}}\n[Persona_3] (4 segundos | confusión | Mira la pantalla)\nSolo voy a esperar a que me respondan para confirmar {{fx stylize.color-grade.coherence.clean.v1.0.0 role=finish intensity=0.28 target=frame contrast=0.08 saturation=0.9 tint=0}}\n[Persona_4] (2 segundos | miedo | Manos en la cabeza)\n¡NOOOO!, No por favor {{fx motion.camera-shake.impact.decay.v1.0.0 role=dominant intensity=0.58 target=frame amplitudePx=10 decayMs=520 frequencyHz=9}} {{fx stylize.color-grade.coherence.clean.v1.0.0 role=finish intensity=0.32 target=frame contrast=0.18 saturation=1.18 tint=0.08}}\n[Persona_4] (2 segundos | miedo | Manos en la cabeza)\nOSD (Dum!) {{fx stylize.light-leak.atmosphere.film.v1.0.0 role=finish intensity=0.3 target=frame color=#ffb15a intensity=0.24}}\n[Persona_3] (2 segundos | confusión | Mira la pantalla)\n¡Solo un minuto y ya! {{fx motion.push-in.emphasis.subtle.v1.0.0 role=dominant intensity=0.4 target=speaker}}\n**SALA**\n\n[Persona_2] (2 segundos | seriedad | Mira su pantalla)\nBueno, ya no respondieron, vámonos... {{fx motion.rack-focus.attention.depth-shift.v1.0.0 role=support intensity=0.32 target=speaker blurPx=10 focusTo=subject}}\n[Persona_2] (2 segundos | seriedad | Mira su pantalla)\nOSD (Yay) {{fx stylize.color-grade.coherence.clean.v1.0.0 role=finish intensity=0.28 target=frame contrast=0.08 saturation=0.9 tint=0}}\n[Persona_4] (2 segundos | seriedad | Se agarra la cabeza)\n¡No tienes que esperar una respuesta! {{fx time.punch-edit.impact.snap.v1.0.0 role=dominant intensity=0.42 target=frame}}\n[Persona_4] (2 segundos | seriedad | Se agarra la cabeza)\nIgual lo puedes revisar mañana {{fx stylize.light-leak.atmosphere.film.v1.0.0 role=finish intensity=0.3 target=frame color=#ffb15a intensity=0.24}}\n[Persona_4] (2 segundos | seriedad | Se agarra la cabeza)\nOSD (Ugh) {{fx motion.push-in.emphasis.subtle.v1.0.0 role=dominant intensity=0.4 target=speaker}}\n[Persona_3] (3 segundos | seriedad | Se toca la barbilla)\nPero, ¿y si me contestan con una duda y no estoy aquí? {{fx motion.rack-focus.attention.depth-shift.v1.0.0 role=support intensity=0.32 target=speaker blurPx=10 focusTo=subject}}\n[Persona_4] (2 segundos | enojo | Agita los brazos)\n¡Que lo resuelvan solos! {{fx stylize.color-grade.coherence.clean.v1.0.0 role=finish intensity=0.28 target=frame contrast=0.08 saturation=0.9 tint=0}}\n[Persona_4] (2 segundos | enojo | Agita los brazos)\n¡Viven de complicarnos la vida! {{fx time.punch-edit.impact.snap.v1.0.0 role=dominant intensity=0.42 target=frame}}\n[Persona_4] (2 segundos | enojo | Agita los brazos)\nOSD (Tsk, tsk) {{fx stylize.light-leak.atmosphere.film.v1.0.0 role=finish intensity=0.3 target=frame color=#ffb15a intensity=0.24}}\n[Persona_1] (3 segundos | seriedad | Suspira)\nBueno, está bien, ¡Vámonos!... {{fx motion.push-in.emphasis.subtle.v1.0.0 role=dominant intensity=0.4 target=speaker}}\n[Persona_3] (2 segundos | seriedad | Sonríe)\nOh, me llegó la respuesta {{fx motion.rack-focus.attention.depth-shift.v1.0.0 role=support intensity=0.32 target=speaker blurPx=10 focusTo=subject}}\n[Persona_3] (2 segundos | seriedad | Sonríe)\nOSD (Dum!) {{fx stylize.color-grade.coherence.clean.v1.0.0 role=finish intensity=0.28 target=frame contrast=0.08 saturation=0.9 tint=0}}\n[Persona_4] (2 segundos | seriedad | Con horror)\n¡NO LO LEAS! {{fx motion.camera-shake.impact.decay.v1.0.0 role=dominant intensity=0.58 target=frame amplitudePx=10 decayMs=520 frequencyHz=9}} {{fx stylize.color-grade.coherence.clean.v1.0.0 role=finish intensity=0.32 target=frame contrast=0.18 saturation=1.18 tint=0.08}}\n[Persona_4] (2 segundos | seriedad | Con horror)\nOSD (Dum!) {{fx stylize.light-leak.atmosphere.film.v1.0.0 role=finish intensity=0.3 target=frame color=#ffb15a intensity=0.24}}\n[Persona_3] (3 segundos | seriedad | Se encoge de hombros)\nPero solo es una línea… {{fx motion.push-in.emphasis.subtle.v1.0.0 role=dominant intensity=0.4 target=speaker}}\n[Persona_2] (3 segundos | seriedad | Manos juntas)\nNo caigas en la trampa… {{fx motion.camera-shake.impact.decay.v1.0.0 role=dominant intensity=0.58 target=frame amplitudePx=10 decayMs=520 frequencyHz=9}} {{fx stylize.color-grade.coherence.clean.v1.0.0 role=finish intensity=0.32 target=frame contrast=0.18 saturation=1.18 tint=0.08}}\n[Persona_3] (2 segundos | seriedad | Frunce el ceño)\nDice: Gracias compañero... {{fx stylize.color-grade.coherence.clean.v1.0.0 role=finish intensity=0.28 target=frame contrast=0.08 saturation=0.9 tint=0}}\n[Persona_3] (2 segundos | seriedad | Frunce el ceño)\nSolo una consulta… {{fx time.punch-edit.impact.snap.v1.0.0 role=dominant intensity=0.42 target=frame}}\n[Persona_3] (2 segundos | seriedad | Frunce el ceño)\nOSD (Dum!) {{fx stylize.light-leak.atmosphere.film.v1.0.0 role=finish intensity=0.3 target=frame color=#ffb15a intensity=0.24}}\n[Persona_4] (2 segundos | seriedad | Manos en el aire)\n¡NOOOOO, POR FAVOR!... {{fx motion.camera-shake.impact.decay.v1.0.0 role=dominant intensity=0.58 target=frame amplitudePx=10 decayMs=520 frequencyHz=9}} {{fx stylize.color-grade.coherence.clean.v1.0.0 role=finish intensity=0.32 target=frame contrast=0.18 saturation=1.18 tint=0.08}}\n[Persona_4] (2 segundos | seriedad | Manos en el aire)\nOSD (Prrrrt) {{fx motion.rack-focus.attention.depth-shift.v1.0.0 role=support intensity=0.32 target=speaker blurPx=10 focusTo=subject}}\n**PASILLO**\n",
  "episodeId": "episodio-17-el-correo-infinito",
  "language": "es-MX",
  "schemaVersion": "1.0",
  "seed": 1724511258,
  "source": {
    "importedFrom": "MAAS/habilidades/creativa-*"
  },
  "status": "draft",
  "title": "Episodio 17 · El correo infinito"
}
