{
  "content": "[Persona_1] (1 segundos | seriedad | Ojos llorosos)\nNo otra vez... {{fx motion.push-in.emphasis.subtle.v1.0.0 role=dominant intensity=0.62 target=speaker easing=ease-out scaleEnd=1.18}} {{fx stylize.color-grade.coherence.clean.v1.0.0 role=finish intensity=0.38 target=frame contrast=0.12 saturation=0.78 tint=-0.08}}\n[Persona_1] (1 segundos | seriedad | Ojos llorosos)\nOSD (Snif, snif) {{fx motion.rack-focus.attention.depth-shift.v1.0.0 role=dominant intensity=0.42 target=speaker blurPx=12 focusTo=subject}}\n[Persona_2] (2 segundos | seriedad | Lleva la mano a la boca)\n¡Puaj! {{fx stylize.light-leak.atmosphere.film.v1.0.0 role=finish intensity=0.38 target=frame color=#ff8a4c intensity=0.32}}\n[Persona_2] (2 segundos | seriedad | Lleva la mano a la boca)\nOSD (Cof, cof) {{fx motion.virtual-dolly.reveal.parallax.v1.0.0 role=dominant intensity=0.34 target=frame depth=0.28 travel=0.2}}\n[Persona_3] (1 segundos | confusión | Gira la cabeza)\n¿Qué rayos...? {{fx stylize.particles.atmosphere.dynamic.v1.0.0 role=finish intensity=0.32 target=frame gravity=0.12 lifeMs=1200 rate=24}}\n[Persona_3] (1 segundos | confusión | Gira la cabeza)\nOSD (¿Eh?) {{fx motion.push-in.emphasis.subtle.v1.0.0 role=dominant intensity=0.48 target=speaker}}\n[Persona_4] (1 segundos | tristeza | Cerrando los ojos)\nCinco minutos más... {{fx motion.rack-focus.attention.depth-shift.v1.0.0 role=dominant intensity=0.42 target=speaker blurPx=12 focusTo=subject}}\n[Persona_4] (1 segundos | tristeza | Cerrando los ojos)\nOSD (Zzzz) {{fx stylize.light-leak.atmosphere.film.v1.0.0 role=finish intensity=0.38 target=frame color=#ff8a4c intensity=0.32}}\n**OFICINA**\n\n[Persona_1] (1 segundos | seriedad | Mira al cielo)\nHmm... eso fue raro. {{fx motion.virtual-dolly.reveal.parallax.v1.0.0 role=dominant intensity=0.34 target=frame depth=0.28 travel=0.2}}\n[Persona_1] (1 segundos | seriedad | Mira al cielo)\nOSD (Hmm) {{fx stylize.particles.atmosphere.dynamic.v1.0.0 role=finish intensity=0.32 target=frame gravity=0.12 lifeMs=1200 rate=24}}\n[Persona_2] (1 segundos | seriedad | Señala con el dedo los labios)\nShhh, creo que escuché algo. {{fx motion.push-in.emphasis.subtle.v1.0.0 role=dominant intensity=0.48 target=speaker}}\n[Persona_2] (1 segundos | seriedad | Señala con el dedo los labios)\nOSD (Shhh) {{fx motion.rack-focus.attention.depth-shift.v1.0.0 role=dominant intensity=0.42 target=speaker blurPx=12 focusTo=subject}}\n[Persona_3] (1 segundos | seriedad | Se contiene)\nEsto es surrealista. {{fx stylize.light-leak.atmosphere.film.v1.0.0 role=finish intensity=0.38 target=frame color=#ff8a4c intensity=0.32}}\n[Persona_3] (1 segundos | seriedad | Se contiene)\nOSD (Jaja) {{fx motion.virtual-dolly.reveal.parallax.v1.0.0 role=dominant intensity=0.34 target=frame depth=0.28 travel=0.2}}\n[Persona_4] (1 segundos | seriedad | Se frota el brazo)\n¡Ay! ¿Quién dejó esto aquí? {{fx stylize.particles.atmosphere.dynamic.v1.0.0 role=finish intensity=0.32 target=frame gravity=0.12 lifeMs=1200 rate=24}}\n[Persona_4] (1 segundos | seriedad | Se frota el brazo)\nOSD (Ay) {{fx time.punch-edit.impact.snap.v1.0.0 role=dominant intensity=0.58 target=frame}}\n**PASILLO**\n",
  "episodeId": "episodio-0-prueba-efectos",
  "language": "es-MX",
  "schemaVersion": "1.0",
  "seed": 1001104799,
  "source": {
    "importedFrom": "MAAS/habilidades/creativa-*"
  },
  "status": "draft",
  "title": "Episodio 0 · Prueba de efectos"
}
